{
  "schema_id": "nexah.compare.analysis-record",
  "schema_version": "0.1.0",
  "record_id": "AN-MARKET-ENTRY-ALPHA",
  "profile_id": "NC01-ADVISORY-0.1",
  "case_id": "CASE-MARKET-ENTRY",
  "source": {
    "source_id": "SRC-ALPHA-01",
    "title": "Synthetic analysis Alpha",
    "producer_class": "HUMAN",
    "source_sha256": "3333333333333333333333333333333333333333333333333333333333333333"
  },
  "claims": [
    {
      "claim_id": "CLM-ALPHA-0001",
      "kind": "FACT",
      "statement": "The admitted dataset reports five percent annual market growth.",
      "materiality": "MATERIAL",
      "evidence_ids": ["EVD-MARKET-0001"],
      "uncertainty": "DECLARED_LOW",
      "conditions": [],
      "calculation": null
    },
    {
      "claim_id": "CLM-ALPHA-0002",
      "kind": "CALCULATION",
      "statement": "The first-year local-team operating cost is EUR 360000 per year.",
      "materiality": "CRITICAL",
      "evidence_ids": ["EVD-COST-0002"],
      "uncertainty": "DECLARED_MEDIUM",
      "conditions": [],
      "calculation": {
        "formula": "monthly_cost * 12",
        "operands": [
          {
            "name": "monthly_cost",
            "quantity": {"value": "30000", "unit": "EUR", "unit_system": "ISO_4217", "time_basis": "MONTH"}
          }
        ],
        "result": {"value": "360000", "unit": "EUR", "unit_system": "ISO_4217", "time_basis": "YEAR"},
        "tolerance": "0"
      }
    },
    {
      "claim_id": "CLM-ALPHA-0003",
      "kind": "RECOMMENDATION",
      "statement": "Use a distribution partner for the first year.",
      "materiality": "MATERIAL",
      "evidence_ids": ["EVD-MARKET-0001", "EVD-COST-0002"],
      "uncertainty": "DECLARED_MEDIUM",
      "conditions": ["Annual partner fees remain below the local-team annual cost"],
      "calculation": null
    }
  ],
  "limitations": ["Partner service-quality evidence is unavailable"],
  "human_confirmation": {
    "status": "CONFIRMED",
    "actor_id": "ACTOR-OWNER-01",
    "confirmed_at": "2026-09-27T12:05:00Z",
    "confirmation_sha256": "bbbbbbbbbbbbbbbbbbbbbbbbbbbbbbbbbbbbbbbbbbbbbbbbbbbbbbbbbbbbbbbb"
  }
}
